{
  "name": "GT Chang",
  "intro": "現職為社群產業數據分析師（Data Analyst）。身為商科兼外文科系背景，卻被數據與程式的世界深深吸引，希望能藉由自己的故事與經歷，鼓勵更多學弟妹們走出自己的路。曾任職於電商、遊戲與輿情產業。目前兼任 PyLadies 入門工作坊講師、1111 平台 Python 家教老師，並在「商業分析師的隨筆記」部落格中記錄著自己一路遇到的職涯大小事。",
  "social_links": {
    "personal": "https://www.bianalyst-gt.com/"
  },
  "photo": ""
}
