{
  "name": "林庭羽 (Amice Lin)",
  "intro": "現職資料科學家，於產業中從事AI與資料相關實務工作，專注於 Python、SQL、GenAI 與機器學習應用以及AI safety議題，也在PyLadies社群擔任志工協助入門工作坊和其他活動。具心理學與認知神經科學背景，對 AI、模型與人類大腦的運作皆抱持高度興趣。相信人生不是線性前進，探索本身就是一種成長與理解的過程。希望透過社群分享與交流，讓大家都能找到自己適合的位置。",
  "social_links": {
    "linkedin": "https://www.linkedin.com/in/tylin-amice/"
  },
  "photo": ""
}
